{
  "$schema": "../feishu-team.schema.json",
  "schema_version": "1.0",
  "team_id": "digital-office-product-team",
  "project_id": "project-template",
  "chat_name": "产品研发办公室",
  "description": "由秘书按任务选择产品研发专家",
  "chat_id_env": "DIGITAL_OFFICE_FEISHU_CHAT_ID",
  "secretary_agent_id": "secretary",
  "policy": {"max_hops": 6},
  "agents": [
    {"agent_id": "secretary", "display_name": "数字办公室秘书", "profile": "office-secretary", "app_id_env": "OFFICE_SECRETARY_APP_ID", "open_id_env": "OFFICE_SECRETARY_OPEN_ID"},
    {"agent_id": "pm", "display_name": "产品经理", "profile": "office-product-manager", "app_id_env": "OFFICE_PM_APP_ID", "open_id_env": "OFFICE_PM_OPEN_ID"},
    {"agent_id": "researcher", "display_name": "产品研究员", "profile": "office-researcher", "app_id_env": "OFFICE_RESEARCHER_APP_ID", "open_id_env": "OFFICE_RESEARCHER_OPEN_ID"},
    {"agent_id": "planner", "display_name": "项目规划师", "profile": "office-planner", "app_id_env": "OFFICE_PLANNER_APP_ID", "open_id_env": "OFFICE_PLANNER_OPEN_ID"},
    {"agent_id": "vibe-designer", "display_name": "体验设计师", "profile": "office-designer", "app_id_env": "OFFICE_DESIGNER_APP_ID", "open_id_env": "OFFICE_DESIGNER_OPEN_ID"},
    {"agent_id": "coder", "display_name": "软件工程师", "profile": "office-coder", "app_id_env": "OFFICE_CODER_APP_ID", "open_id_env": "OFFICE_CODER_OPEN_ID"},
    {"agent_id": "writer", "display_name": "产品文档工程师", "profile": "office-writer", "app_id_env": "OFFICE_WRITER_APP_ID", "open_id_env": "OFFICE_WRITER_OPEN_ID"},
    {"agent_id": "legal", "display_name": "数字律师", "profile": "office-legal", "app_id_env": "OFFICE_LEGAL_APP_ID", "open_id_env": "OFFICE_LEGAL_OPEN_ID"}
  ]
}
